{
  "id": "dQw4w9WgXcQ",
  "channelId": "UCBcRF18a7Qf58cCRy5xuWwQ",
  "title": "Scenic Train Ride Through the Swiss Alps — 4K Cab View",
  "description": "A relaxing front-window train journey through the Swiss Alps, from Chur to Tirano on the Bernina Express route.",
  "publishedAt": "2026-03-18T08:00:00Z",
  "thumbnailUrl": "https://i.ytimg.com/vi/dQw4w9WgXcQ/maxresdefault.jpg",
  "duration": "PT2H15M00S",
  "viewCount": 84200,
  "likeCount": 3100,
  "liveBroadcastContent": "none",
  "captionsAvailable": false,
  "source": "youtube",
  "updatedAt": "2026-03-20T10:00:00Z",
  "tags": ["trains", "scenery", "4k", "long-form"]
}
